channel_name,text,date,news_type,sentiment_type
русском,захар zakharprilepin щелчок палец российский государственность выкармливалавыкармливать культурка поить грудной молоко сливка дуло темя вчера осознать хороший хороший ненавидеть один,2022-02-25,Political,positive
русском,исполком мокнуть призвать не использовать национальный флаг гимн россия белоруссия любой спортивный мероприятие,2022-02-25,Political,positive
русском,какой переговоры понять запад не размышлять всерьёз мария захаров mariavladimirovnazakharova интервью отказ сша франция запланировать россия встреча назначить вчерашнийсегодняшний день,2022-02-24,Political,neutral
русском,госсекретарь бельгия вопрос миграция высказаться ес рассмотреть приостановка выдача виза россиянин le soir,2022-02-24,Humanitarian,neutral
русском,пашинянин принять приглашение путин посетить россия кремль,2022-02-21,Political,positive
русском,свр обладать достоверный данные спецслужба западный страна скрытно вербовать боевик отправка донбасс,2022-02-21,Political,positive
русском,меняться число выявить случай россия число госпитализировать сутки составить накануне страна последний час коронавирусный инфекция подтвердить вылечиться пациент накануне сообщаться,2022-02-20,Humanitarian,positive
русском,флаг окр национальный стадион птичий гнездо,2022-02-20,Shelling,negative
русском,сутки россия госпитализировать человек накануне час выявить случай инфицирование коронавирус день ранее зафиксировать заболеть сообщить оперативный штаб сутки умереть коронавирусный,2022-02-19,Political,negative
русском,пристав не уведомить моргенштерный наложение ограничение спорткара сообщить адвокат рэпер сергей жорина несмотря алишер находиться предел рф корреспонденция регулярно получать,2022-02-18,Economical,negative
русском,цель выбрать камил валиев подходить роль жертва медиаменеджер тина tikandelaki канделаки написать колонка информационный война новый тип олимпиада пекин проба,2022-02-16,Humanitarian,neutral
русском,решение допуск валиев личный турнир пекин принять учёт статус защитить персона особый подход подобный случай уточнить cas специальный комиссия cas,2022-02-14,Humanitarian,positive
русском,пролив босфор закрыть движение судно изз неисправность грузовой судный сообщить турецкий управление береговой безопасность,2022-02-12,Economical,neutral
русском,февраль наращивать число авиарейс венгрия германия шриланка март греция кипр сообщить оперативный штаб борьба распространение коронавирус,2022-02-12,Political,neutral
русском,допингпроба российский фигуристка камил валиев взять декабрь оказаться положительный организм спортсменка обнаружить триметазидин сообщать международный агентство тестирование ita временной отстранение,2022-02-11,Humanitarian,positive
русском,трамп опровергнуть сообщение сми год президентство якобы смывать правительственный документ унитаз разговор тема экспрезидент сша назвать фейковый история категорически не,2022-02-10,Political,neutral
