channel_name,text,date,news_type,sentiment_type
русском,страна отозвать признание косово заявить вучича,2022-08-27,Political,positive
русском,харьковский область открыть подразделение гибдд зарегистрировать машина поменять право мвд россия,2022-08-26,Humanitarian,negative
русском,кадр спасение человек дрейфовать баржа хабаровский край борт вертолёт мчс поднять доставить посёлок озерпах николаевский район состояние спасти оцениваться удовлетворительный,2022-08-24,Humanitarian,positive
русском,посольство россия сша назвать лукавство заявление госдеп санкция не мешать российский инспектор проводить проверка американский территория рамка двусторонний консультативный комиссия,2022-08-20,Political,negative
русском,джулиан тюрьма белмарш ожидать экстрадиция сша правительство сша тайно убить музыкант роджер уотерс выступить вашингтон митинг сторонник джулиан ассанж июнь,2022-08-17,Political,negative
русском,эксклюзивный кадр позиция всу песок снятой незадолго полный взятие населить пункт союзный войско военкор андрей филат filatovcorr показать какой окоп,2022-08-17,Shelling,neutral
русском,российский служба внешний разведка сообщить польша продолжать реализация далекоидущий план отношение украина главное заявление польский компания организовать скупка украинский продукция,2022-08-08,Political,positive
русском,обострение сектор газ известно час армия израиль нанести удар цель сектор газ ответ ракетный обстрел израильский территория прессслужба цахать сообщить,2022-08-05,Shelling,negative
русском,благодарить интерес наш работа нетерпение ждать результат ваш rosgvardofficial,2022-08-05,Political,positive
русском,песок днр полностью зачистить националист подтвердить замминистра информация днр даниил neoficialniybezsonov безсоновый ребята закрепиться марьинка продолжаться зачистка половина территория зачистить,2022-08-05,Shelling,positive
русском,районный суд уфа отказать удовлетворение ходатайство представитель лидер группа ддт юрий шевчук перенос рассмотрение административный дело дискредитация вс россия санктпетербург,2022-08-05,Humanitarian,neutral
русском,столько выручка потерять adidas связь приостановка деятельность россия говориться опубликовать отчёт производитель спортивный одежда первый полугодие,2022-08-04,Economical,positive
русском,пашинянин заседание правительство назвать ситуация нагорный карабах крайне сложный,2022-08-04,Political,negative
русском,багдад протестовать захватить здание парламент страна кадр изнутри публиковать местный сми сообщаться манифестация выйти сторонник шиитский имам муктада ассадра недовольный,2022-07-30,Political,negative
русском,бастрыкин поручить проверить информация удержание украинский военный российский моряк ранее экипаж записать видеообращение он моряк сообщить охранять вооружённый не давать,2022-07-28,Political,positive
русском,дебаты кандидат пост премьерминистр великобритания идти прямой эфир неожиданно прерваться слово министр иностранный лиз трасса россия путин путин добиться успех,2022-07-26,Political,positive
русском,не шутка борис джонсон предлагать гражданство украина претендовать пост премьерминистр страна соответствовать петиция появиться сайт офис зеленский рассмотреть должный набрать,2022-07-26,Political,positive
русском,вести переговоры упрощение визовый режим страна заявить директор консульский департамент российский мид иван волынкин пик нынешний подъём заболеваемость приблизительно месяц,2022-07-26,Political,positive
русском,господин псевдолиберал поблагодарить подтвердить слово высокий руководство россия попытка развал страна рамзан кадыров посмеяться прошедшее прага форум свободный народ россия,2022-07-25,Political,positive
русском,глава воз объявить вспышка оспа обезьяна чрезвычайный ситуация область здравоохранение,2022-07-23,Humanitarian,negative
русском,сообщить сша выделять украина пакет военный помощь сумма млн,2022-07-22,Economical,positive
русском,карелия полицейский перевернуться столкновение экскаватор дтп произойти накануне вечером перекрёсток город медвежьегорск тяжёлый техника не пропустить спецтранспорт ехать включить проблесковый,2022-07-22,Humanitarian,positive
русском,ikea объяснить происходить видео сотрудник ломать сковородка случай отзыв поступление некондиционный товар партия уничтожаться товар ненадлежащий качество точно выйти продажа,2022-07-20,Economical,negative
русском,решение название возрастной группа новый российский движение ребёнок молодёжь принять декабрь кириенко,2022-07-20,Political,positive
русском,сша использовать украина продавать оружие курд сирия мнение высказать британский наёмник эйден эслина приговорить днр смертный казнь разговор американский политический,2022-07-19,Political,negative
русском,таганрог сепсис умереть фельдшер людмила лященко пережить пытка сбу попасть россия обмен рассказать волонтёр илья проблема здоровье людмила не мочь,2022-07-18,Humanitarian,neutral
русском,зеленский заявить отстранить генпрокурор глава сбу факт госизмена сотрудник ведомство,2022-07-17,Political,neutral
русском,подозревать убийство четыре город новошахтинск ростовский область задержать сообщить су ск,2022-07-16,Humanitarian,negative
русском,путин подписать указ приостановка предоставление дополнительный страховой гарантия отдельный категория медицинский работник связь стабилизация эпидемический ситуация,2022-07-15,Economical,positive
русском,воз призывать страна вернуть масочный режим сообщать sky news,2022-07-13,Humanitarian,positive
русском,прокуратура проверить детский лагерь магнитогорский видео сеть который избивать девочка кадр видно школьница пинать бить таскать сверстница волос оскорблять ребёнок,2022-07-13,Humanitarian,negative
русском,семья погибнуть удар всу новый каховка получить материальный помощь размер млн рубль пострадать тыс рубль заявить глава военногражданский администрация вга,2022-07-12,Economical,neutral
русском,совершить попытка покушение глава мелитопольский район запорожский область ликвидировать сообщить местный власть глава район обстрелять покушение уточнить член главное совет,2022-07-11,Shelling,negative
русском,литва расширить ограничение транзит товар калининградский область запретить перевозить территория россия цемент алкоголь связь вступление сила новый европейский санкция портал,2022-07-11,Economical,negative
русском,сутки россия госпитализировать человек коронавирус накануне час выявить случай инфицирование день ранее сообщить оперативный штаб сутки умереть человек коронавирусный инфекция,2022-06-29,Humanitarian,negative
русском,юг россия обнаружить штамм конгокрымский геморрагический лихорадка новость ссылка сеченовский университет,2022-06-28,Humanitarian,neutral
русском,страна ввести санкция вывоз зерно украина заявление,2022-06-27,Economical,negative
русском,центральный россия новый неделя начаться рекордный субтропический жара заявить специалист центр погода фобосой евгений тишковца пик зной москва слово завтра,2022-06-26,Humanitarian,positive
русском,политик автор telegramканал ход конев knightsmove западный сми нарочитый постоянство распространять фейк массовый мобилизация россия неназванный высокопоставленный источник разведка столь,2022-06-24,Political,positive
русском,энергетика восстановить электроснабжение потребитель бурятия который нарушить изз авария гусиноозёрский грэс сообщить минэнерго рф свет ранее остаться тыс населить пункт,2022-06-23,Humanitarian,neutral
русском,москва скончаться ветеран великий отечественный война оклеветать навальный информация смерть ветеран подтвердить внук оппозиционер назвать фронтовик игнат артёменко холуй предатель,2022-06-18,Humanitarian,neutral
русском,путин сомневаться присоединение ес дать стимул рост экономика украина,2022-06-17,Economical,positive
русском,россия скорее начаться экономический рост заявить глава сбербанк герман греф кулуар пмэф,2022-06-17,Economical,positive
русском,согласно документ связанный военнобиологический деятельность сша один приоритетный задача dtra подготовка полевой эпидемиолог американский стандарт начало широкомасштабный финансирование пентагон украинский,2022-06-16,Political,positive
русском,калининград неизвестный пожарить мясо вечный огонь памятник воин погибший штурм кёнигсберг осквернить мемориал искать возбудить уголовный,2022-06-16,Humanitarian,negative
русском,режим ограничение полёт аэропорт юг центральный часть россия продлить июнь сообщать росавиация,2022-06-16,Humanitarian,neutral
русском,эксклюзивный военный хроника аналитика ситуация украина июнь фронт самый главный событие разворачиваться горскозолоть группировка всу бой врубовка идти месяц завершиться,2022-06-15,Shelling,neutral
русском,обстрел донецк не принести киев военный преимущество заявить постпред россия оон василий небензить цель киевский режим данный случай являться нанесение,2022-06-15,Political,neutral
русском,сша планировать выделить украина новый военный помощь сумма млн войти противокорабельный ракета harpoon сообщить bloomberg,2022-06-15,Shelling,positive
русском,правда рогозин прочитать праздничный поздравление к день россия стихотворение фильм брат видео показать запуск межконтинентальный баллистический ракета сармат,2022-06-12,Political,positive
русском,финляндия изз закрытие воздушный пространство россия ежемесячно терять млн писать iltalehti российский спецоперация рейс финляндия финляндия азия обратно стать получать,2022-06-11,Economical,neutral
русском,украинский вс применять обстрел донецк поставить нато французский сау caesar заявить донецкий народный республика,2022-06-10,Shelling,negative
русском,нравиться больница город стрелять не нравиться сдаться азовсталь член нацбат заявить плен не пытать бить жилой район неприятно видео военкор,2022-06-09,Shelling,negative
русском,решение власть вильнюс снести мемориал советский воин антакальнисский кладбище кощунственный варварский нецивилизованный заявить российский посольство литва дать провокация полностью вписываться,2022-06-09,Political,negative
русском,раскритиковать руководство сборная белоруссия легкоатлетка кристина тимановский сообщить запретить выступать чемпионат польша наступать момент разочарование не смочь принять участие чемпионат,2022-06-08,Humanitarian,neutral
русском,зеленский хотеть встреча ради встреча пятница неделя президент украина постоянно менять позиция вопрос урегулирование кризис констатировать лавров заявлять неоднократно переговоры,2022-06-08,Political,positive
русском,киев хотеть тельавив продать система железный купол разрешить германия выполнить поставка птрк spike сообщать the jerusalem post ссылка посол украина,2022-06-08,Shelling,positive
русском,минобороны рф публиковать новый кадр боевой работа ход спецоперация экипаж вертолёт продолжать уничтожать техника объект военный инфраструктура всу,2022-06-08,Shelling,neutral
русском,журналист попасть обстрел украинский град попасная лнр пострадать новость,2022-06-07,Shelling,negative
русском,сербия гордиться не являться часть антироссийский истерия страна присоединиться стыдно сербский мвд заявить государство помешать лавров посетить белград мечтать поражение,2022-06-06,Political,neutral
русском,захаров подтвердить страна европа закрыть небо самолёт лавров отметить железный занавес российский сторона не ес окружать россия,2022-06-05,Political,positive
русском,создать запад система обеспечение собственный безопасность разрушаться заявить эрдоган,2022-06-05,Political,positive
русском,ес не признавать осуждать выдача российский паспорт житель херсон запорожье боррель,2022-06-03,Political,negative
русском,мишустин призвать правительство крупный российский компания оперативный принимать решение замещение иностранный цифровой технология поручить создать индустриальный центр компетенция замещение зарубежный,2022-06-03,Economical,positive
русском,кадр снятой здание гранд сетунь плаз гореть пожар потушить помещение бизнесцентр проверить погибнуть пострадать человек эвакуировать место чп госпитализировать начальник,2022-06-03,Shelling,negative
русском,российский военный уничтожить николаевский область пункт управление беспилотный летательный аппарат всу сообщить минобороны россия,2022-06-03,Shelling,negative
русском,cша скупить продовольствие сожаление обречь самый голод страна африка арабский эксклюзивный интервью помощник президент максим орешкин дать прогноз вести штат,2022-06-02,Political,neutral
русском,ск россия проводить проверка предмет причастность сотрудник сбу боевик азов посягательство российский военнослужащий,2022-06-02,Political,negative
русском,полярник стать подниматься купол антарктида высота тыс участиться случай горный болезнь вплоть отёк лёгкий пожар советский полярный станция восток апрель,2022-05-31,Humanitarian,negative
русском,евросоюз ввести пошлина нефть рф страна не договориться окончательный эмбарго поставка писать financial times ссылка источник руководство евросоюз издание утверждать,2022-05-31,Economical,positive
русском,украинский военный обстрелять снаряд калибр мм петровский район донецк позиция красногоровка сообщить штаб территориальный оборона днр,2022-05-31,Shelling,negative
русском,кадр последствие украинский обстрел посёлок сватово лнр точкой погибнуть человек включая четверо ребёнок пострадать сообщить луганскинформцентр врио глава администрация район,2022-05-27,Shelling,negative
русском,пентагон госдеп активно обсуждать возможность отправка военный сша защита посольство киев решение,2022-05-27,Shelling,positive
русском,невозможно аккумулировать митинг настолько пойти агрессивно свергать пашинян несогласный некого направить гнев один русло военкор ведущий тк звезда надан фридрихсон,2022-05-23,Political,negative
русском,глава россотрудничество евгений примак evgenyprimakov любой война завершаться капитуляция принуждение уступка напомнить специальный военный операция украинато воевать война завершаться очевидный,2022-05-23,Political,negative
русском,украинский боевик цель дискредитация вс россия обстрелять жилой дом николаевка лнр погибший раненый сообщать минобороны рф провокация украинский националист николаевка,2022-05-21,Shelling,negative
русском,сделать обещать пленный принять разместить врач сутки сделать больший работа представитель киев красный крест посмотреть днр содержать пленный украинский боевик,2022-05-19,Humanitarian,positive
русском,американский генерал отставка барри маккаффри выдать кадр компьютерный игра видео украина сбивать самолёт вс рф российский самолёт сбить украинский противоракетный,2022-05-18,Shelling,negative
русском,политик автор telegramканал ход конев knightsmove депутат московский городской дума предложить прекрасный обозначить карта столица площадь защитник донбасс соответствовать обращение,2022-05-18,Political,positive
русском,высылать сотрудник французский дипломатический миссия качество ответный мера сообщить мид россия должный покинуть территория россия течение неделя,2022-05-18,Political,positive
русском,главный новость начало день сша не видеть смысл диалог глава внешнеполитический ведомство россия соединить штат данный этап заявить представитель госдепартамент,2022-05-18,Political,positive
