channel_name,text,date,news_type,sentiment_type
русском,эксклюзив ночью взорвать мост выезд мелитополь основный пролёт просесть движение перекрыть передавать военкор влад vandrytsa андрица место работать кинолог сапёр,2022-12-13,Shelling,negative
русском,путин заявить необходимость создание отдельный программа восстановление жильё помощь житель донбасс помогать человек утратить жилой помещение начинать февраль начаться тяжёлый,2022-12-07,Political,positive
русском,путин поздравить президент киргизия жапаров день рождение обсудить вопрос двусторонний повестка день сообщить кремль подписаться русский,2022-12-06,Political,positive
русском,пленный красноармеец пытать волоколамский район подмосковье немецкий оккупант запереть четырёхэтажный дом день поджечь пытаться спастись выпрыгивать окно расстреливать следовать рассекретить,2022-12-05,Shelling,negative
русском,украинский сми паблик сообщать взрыв херсон подписаться русский,2022-12-03,Shelling,negative
русском,дождь смииноагент попасть скандал телеканал уволить ведущий алексей коростелевый эфир имя редакция надеяться многий военнослужащий число смочь помочь например оснащение,2022-12-02,Political,positive
русском,канье уэст заявить симпатия гитлер популярный сторонник трамп соцсеть parler объявить отменить продажа сервис рэпер twitter блокировка музыкант сообщать axios,2022-12-02,Political,positive
русском,еврокомиссия предложить страна ес принять потолок цена нефть рф уровень баррель сообщать the wall street journal подписаться русский,2022-12-01,Economical,positive
русском,абонент оставаться свет киевский область заявить губернатор алексей кулеб слово регион происходить экстренный отключение ситуация усугубляться провод обрываться изз обледенение,2022-11-28,Political,negative
русском,акция яндекс снижаться новость изменение структура компания свидетельствовать дать мосбиржа подписаться русский,2022-11-25,Economical,positive
русском,путин обратиться мать военнослужащий погибнуть ход сво хотеть знать лично руководство страна разделять боль понимать не заменить утрата сын утрата,2022-11-25,Political,positive
русском,украинский плен вернуться российский боец заявить пушилин слово столько основное военный всу отдать украина накануне минобороны сообщить плен вернуться российский,2022-11-24,Political,positive
русском,путин заявить опыт применение сила одкб казахстан проанализировать поддерживать решение оснащение сила современный вооружение подписаться русский,2022-11-23,Political,positive
русском,редактор иа regnum писатель журналист член спч марина ахмедов marinaslovo появиться сообщение лидер бессмертный полка выложить свой сайт националистический террористический,2022-11-22,Political,positive
русском,генпрокуратура украина обвинить российский военный сымитировать сдача плен вероломно напасть украинский ранее сеть появиться видео который всу расстреливать безоружный боец,2022-11-22,Political,negative
русском,мид польша подтвердить отказ допустить лавров участие заседание совет министр иностранный обсе планировать лодзь декабрь подписаться русский,2022-11-21,Political,positive
русском,стратегия освобождение крым путин свободный ой слабый экспрезидент украина порошенко беседа майкл макфол вид позвонить пранкеры вован лексус рассказать план,2022-11-17,Political,positive
русском,польша готовиться возможность падение ракета польский территория заявить премьер страна ход выступление сейм подписаться русский,2022-11-16,Political,positive
русском,минобороны россия ноябрь российский вооружённый сила нанести массировать удар высокоточный оружие дальность воздушный морской базирование система военный управление украина ракета,2022-11-16,Shelling,negative
русском,президент польша проводить разговор байден заявить канцелярия польский президент подписаться русский,2022-11-15,Political,positive
русском,выпускник запорожский херсонский область днр лнр получить аттестат окончание школа экзамен заявить председатель движение россия владимир рогов подписаться русский,2022-11-15,Humanitarian,positive
русском,британский пограничник вмс франция сговориться ламанше сопровождать лодка нелегальный мигрант великобритания писать daily mail публиковать выдержка переговоры запись экипаж связываться,2022-11-15,Humanitarian,positive
русском,учить язык родный язык жительница мариуполь рассказать рада ребёнок спокойно учиться русский язык не давать нормальный пятёрка не ставить должный,2022-11-14,Humanitarian,positive
русском,результат упорный бой армия россия полностью освободить павловка днр заявить минобороны подписаться русский,2022-11-14,Shelling,positive
русском,правоохранительный орган рассматривать версия теракт связь взрыв центр стамбул сообщить новость источник подписаться русский,2022-11-13,Humanitarian,neutral
русском,кадр мосгорсуд признать законный выдворение блогер некоглай молдавия заседание обрить некоглай заявить стыдно каяться пародия российский боец дрон всу забрасывать,2022-11-11,Humanitarian,positive
русском,эксперт центр военнополитический журналистика автор telegramканал borisrozhin борис рожин штормовой подразделение бригада морской пехота бригада обтф каскад установить контроль важный,2022-11-10,Shelling,positive
русском,италия не готовить пакет помощь украина не исключать возобновление поставка вооружение будущее информация подтвердить издание il messaggero министр оборона страна,2022-11-10,Political,positive
русском,король карла iii супруг камилла закидать яйцо йорк инцидент произойти королевский чета приехать йоркшир открытие статуя елизавета ii мужчина бросать,2022-11-09,Shelling,neutral
русском,постпред сша оон линда томасгринфилд прибыть киев отметить непоколебимый поддержка украина заявить американский дипмиссия,2022-11-08,Political,positive
русском,минобороны сообщить результат переговоры подконтрольный киев территория возвратить военный россия который плен грозить смертельный опасность освободить российский военнопленный доставить москва,2022-11-03,Shelling,negative
русском,главный заявление секретарь сб рф николай патрушев сша великобритания вербовать международный террорист участие боевой действие сторона киевский режим украина превратиться,2022-11-03,Political,neutral
русском,соцсеть расходиться видео который предположительно украинка пытаться попасть запорожский область итог въезд отказывать утверждать сеть изз оскорбление адрес рф российский,2022-11-02,Shelling,negative
русском,instagram соцсеть запретить рф глобальный сбой пользователь разный страна жаловаться аккаунт полностью заблокировать не пройти авторизация,2022-10-31,Humanitarian,negative
русском,правительство продлить некоторый мера поддержка бизнес мишустин,2022-10-31,Economical,positive
русском,взрыв произойти здание минобразования столица сомали могадишо погибнуть малый мера пострадать reuters ссылка президент,2022-10-30,Humanitarian,negative
русском,всу нанести удар технопарк проминь энергодар сообщить глава городской администрация александр волга уточнить пострадать ранее стать известно ночью украинский десант,2022-10-29,Shelling,negative
русском,пленный украинский военный днр просить закрашивать националистический надпись татуировка рассказать силовой структура республика,2022-10-29,Humanitarian,neutral
русском,украинский ракета сбить сила пво небо макеевка писать местный паблик сообщаться всу наносить удар семь час обломок ракета упасть возле,2022-10-29,Shelling,negative
русском,путин европа разговаривать партнёр каждый вопрос звонить вашингтонский обком,2022-10-27,Economical,positive
русском,отличие запад чужой двор не лезть путин,2022-10-27,Political,neutral
русском,харьковский область уничтожить узел связь украинский войско район днепропетровск поразить нефтехранилище группировка всу донбасс минобороны рф,2022-10-26,Shelling,negative
русском,житель аризона жаловаться вооружённый патруль стать охранять урна голосование преддверие выборы американский сенат мужчина снаряжение заметить пригород феникс район местный,2022-10-25,Political,positive
русском,запорожский область подключить единый газотранспортный система рф заявить председатель движение россия владимир рогов,2022-10-25,Economical,neutral
русском,буквально рука носить некоторый житель правобережный часть херсон прибыль анапа разместить местный пансионат гостиница человек оказать всесторонний помощь встретить довезти,2022-10-20,Humanitarian,positive
русском,эрдоган заявить договориться путин повод создание газовый хаба европа смочь использовать российский газ турция,2022-10-19,Political,positive
русском,украинский сторона накапливаться сила широкомасштабный наступление рф сформировать военный группировка отбить наступление врио губернатор херсонский область сальдо обратиться житель заявление,2022-10-18,Shelling,negative
русском,новый кадр дом пострадать падение самолёт ейск предварительный оценка власть повредить многоэтажка восстановить окончательный решение обнародовать экспертиза рухнуть двор дом,2022-10-18,Shelling,neutral
русском,эксклюзив барракуда приём отправить подарочек кадр миномётный обстрел позиция всу район белогоровка лнр огонь противник вестись руководство командир батальон казачий,2022-10-15,Shelling,negative
русском,николаевский одесский область объявить воздушный тревога сообщить глава местный администрация,2022-10-14,Shelling,negative
русском,белгородский паблик сообщать новый громкий хлопок предположительно работать пво ссылка очевидец говориться ряд житель город пропасть,2022-10-14,Shelling,neutral
русском,писатель доброволец владлен татарский vladlentatarsky фсб установить теракт крымский мост причастный гур мо украина лично руководитель организация кирилл буданов напомнить,2022-10-12,Political,positive
русском,центр киев снести старинный памятник пушкин установить личный сбережение учитель ученик киевопечерский гимназия писать украинский сми демонтаж посвятить боец всу,2022-10-11,Humanitarian,positive
русском,сутки россия госпитализировать коронавирус накануне больница попасть пациент сообщить оперативный штаб час выявить случай инфицирование день ранее сутки умереть человек,2022-10-09,Humanitarian,neutral
русском,генпрокуратура рф взять контроль цена продукт топливо крым подрыв крымский мост прессслужба ведомство отметить оператор топливный рынок представитель торговый сеть,2022-10-08,Economical,neutral
русском,глава цик рф элла памфилов включить список персональный санкция ес,2022-10-06,Economical,negative
русском,путин свой путём уважение относиться к украинский млн гражданин россия украинский происхождение не делать не делать разница не собираться разница,2022-10-05,Political,neutral
русском,москва непринципиально признание запад вступление состав россия днр лнр запорожский херсонский область заявить сергей лавров правильный страна осознать новый реальность,2022-10-04,Political,positive
русском,георгиевский зал кремль готовый подписание договор присоединение рф новый регион,2022-09-30,Political,positive
русском,песок заявить кремль поддерживать глава дагестан критика перегиб частичный мобилизация,2022-09-30,Political,neutral
русском,минцифра рф опубликовать список специальность подходящий критерий освобождение частичный мобилизация специалист it связь ведомство информацияпромобилизация,2022-09-26,Economical,positive
русском,военкор влад vandrytsa андрица показать выглядеть мобильный пункт голосование автобус оборудовать центральный клинический больница луганск автомобиль выстроиться очередь желать отдать,2022-09-23,Shelling,positive
русском,кабмин собирать задавать вопрос россиянин частичный мобилизация министерство оборона готовить ответ заявить чернышенко,2022-09-22,Political,positive
русском,глава вга харьковский область виталий ганчев считать харьковчанин скоро смочь проголосовать присоединение рф главное заявление житель регион не прекратить борьба,2022-09-21,Political,positive
русском,журналист публицист максим кононенко kononenkome прийтись прочитать множество мнение оторваться власть народ мнение основное не целиком произноситься откудато изз рубеж,2022-09-21,Political,positive
русском,киев вашингтон не доказать сотрудничество улучшить санитарный обстановка украина ухудшаться подряд заявить минобороны россия,2022-09-19,Political,positive
русском,кадр площадь ленин ворошиловский район донецк обстреливать всу пострадать девушка слово очевидец повредить позвоночник точный число раненый неизвестно слово мэр,2022-09-17,Shelling,negative
русском,потеря всу результат высокоточный удар николаевский херсонский область составить убитый раненый сообщить минобороны россия,2022-09-17,Shelling,negative
русском,мировой политика экономика наметиться фундаментальный трансформация носить необратимый характер путин заседание совет глава государство член шос,2022-09-16,Political,positive
русском,публикация британский таблоид the sun якобы иметь покушение президент россия не соответствовать действительность заявить новость дмитрий песок,2022-09-15,Political,negative
русском,фашизм владелец ресторан бахчисарай извиниться свадьба заведение звучать украинский песня червона калин считать гимн украинский националист эльдар качкар заявить поддерживать,2022-09-14,Humanitarian,positive
русском,стратегический запас нефть сша сократиться показатель резерв составлять млн баррель последний неделя потратить млн баррель сообщать reuters ранее агентство bloomberg,2022-09-13,Economical,positive
русском,медведица диксон обнаружить множество ранение картечь дробь сообщить гендиректор московский зоопарк светлана акуловый получение результат томография картина мягко говорить не,2022-09-11,Humanitarian,positive
русском,ракета искандер нанести удар живой сила военный техника украинский войско выгрузка жд станция красноармейск днр сообщить мо россия,2022-09-11,Shelling,negative
русском,вспоминать тренироваться заходить минута потеть потолок опасно амплитудный бросать нога потолок задеть путин посетить международный центр самбо бокс лужники пообщаться,2022-09-10,Humanitarian,positive
русском,источник илья пономарёв координировать деятельность украинский воинский подразделение легион свобода россия выясниться ход сегодняшний обыск видео администратор youtube telegramканал найти,2022-09-08,Political,positive
русском,поставлять не рамка контракт остаться один известный русский сказка приговаривать мёрзнимёрзнуть волчий хвост готовый поставлять энергоресурсы запад рамка контрактный обязательство,2022-09-07,Economical,positive
русском,лиз трасса приехать аудиенция елизавета ii королева принять отставка джонсон встретиться новоизбранный премьер трасса поручение сформировать правительство примечательно студенческий год,2022-09-06,Political,positive
русском,сеть расходиться кадр утверждаться погибший спецназовец морской пехота всу никополь писать последствие неудачный высадка украинский десант днепр официальный комментарий ранее,2022-09-05,Shelling,negative
русском,завершить работа восстановление мемориал саурмогила днр разрушить бой сообщить военностроительный комплекс минобороны россия реставрация уйти день исторический облик комплекс полностью,2022-09-04,Economical,positive
русском,украинский войско нанести удар многоквартирный жилой дом херсон погибший пострадать новость ссылка местный власть,2022-09-02,Shelling,negative
