channel_name,text,date,news_type,sentiment_type
украина новости война,очередной вагнеровец попасть плен праздничный упаковка ответ первый фото подоспеть занимательный мем готовиться утренник хлопушка,2022-12-11,Shelling,positive
украина новости война,украинский лента клондайк попасть полный список номинант премия оскар клондайк художественный фильм украинский режиссёр марина эра горбач событие фильм разворачиваться,2022-12-10,Humanitarian,positive
украина новости война,ботоксный диктатор осмотр крымский мост поздравить российский волонтёр праздник президент рф владимир путин посетить московский форум посвятить помощь волонтерство вручить,2022-12-05,Political,positive
украина новости война,одесский область повредить энергетический инфраструктура попадание дом объект гражданский инфраструктура сообщать одесский ова ранить человек настоящий электроснабжение отсутствовать одесса большинство,2022-12-05,Shelling,neutral
украина новости война,фон отключение электричество интернет пропадать одесса сумах житомир ,2022-12-05,Humanitarian,neutral
украина новости война,россия запутаться воевать пропагандистка симоньян призывать бомбить не киев вашингтон лондон берлин ,2022-12-04,Political,negative
украина новости война,луганщина оккупант устроить показательный казнь слово ,2022-12-04,Humanitarian,negative
украина новости война,поддержка всу оккупант новость ,2022-12-03,Shelling,negative
украина новости война,польский сейм не смочь принять резолюция признание рф государствомспонсор терроризм изз внести правящий партия поправка принятие заблокировать оппозиция поправка говориться,2022-12-02,Political,neutral
украина новости война,зеленский считать путин не применить ядерный оружие война украина не думать применить ядерный оружие заявить зеленский видеовыступление мероприятие организовать газета,2022-11-30,Political,negative
украина новости война,остаток снаряд который российский войско обстреливать харьков город собирать сапёр фото reuters ,2022-11-30,Shelling,negative
украина новости война,пво не наступление защита ребёнок мирный население ракетный удар михаил подоляк высказаться инициатива передать украина зрк patriot мудрый инициатива польша,2022-11-27,Political,positive
украина новости война,медведев вылезти ненадолго запой решить напомнить свой поддать главный пункт рашистский пропаганда напоследок заикнуться захват киев интересно день ,2022-11-20,Political,neutral
украина новости война,настоящий поддержка байрактар спутник мощь батарейка ,2022-11-18,Shelling,positive
украина новости война,карта российский ракетный удар украина данный момент ,2022-11-15,Shelling,negative
украина новости война,белгород чтоть сильно гореть ,2022-11-14,Shelling,negative
украина новости война,всу установить контроль макеевка луганский область заявлять ова ,2022-11-13,Political,neutral
украина новости война,бомба взорвать террористсмертник улица находиться российский консульство ,2022-11-13,Shelling,negative
украина новости война,военный база оккупант временно оккупировать мелитополь густой туман мэр фёдоров утренний погода мелитополь не польза русский гром молния сильный ветер,2022-11-03,Humanitarian,negative
украина новости война,страна нато передать украина вооружение мёртвый оккупант сутки русне украина вспоминать ,2022-11-02,Political,negative
украина новости война,украинец необходимо начинать подготовка сложный зима заявить премьерминистр украина денис шмыгаль государство готовиться запасаться дополнительный оборудование украинец должный готовиться сложный,2022-11-01,Political,positive
украина новости война,отбой тревога страна следить сообщение свой регион беречь ,2022-10-31,Shelling,negative
украина новости война,российский войско не добиться значительный прогресс район бахмут целое вдоль линия фронт isw фальсифицировать заявление наступление район бахмут изобразить успех,2022-10-29,Shelling,negative
украина новости война,батька син дядько чоловіка з однієї родиня плічопліча визволяють українські землі від російський окупантіть під контрнаступа херсонщині йий батька підірвався,2022-10-26,Political,neutral
украина новости война,вооружённый сила украина обратиться российский войско кидать уба расходный материал потеря не считать украина не угрожать российский федерация подумать семья,2022-10-24,Political,positive
украина новости война,всу неделя демилитаризировать склад бк руснуть база кп ,2022-10-24,Shelling,negative
украина новости война,житель черкащина предупреждть высокий вероятность удар воздух ,2022-10-21,Political,neutral
украина новости война,завтра весь украина вводиться ограничение поставка электроэнергия заявить замглавы оп тимошенко начинать необходимо минимизировать пользование электроэнергия касаться житель область страна,2022-10-19,Political,positive
украина новости война,путин объявить война запад цитировать spiegel слово глава федеральный разведывательный служба германия президент управление защита конституция фрг глава немецкий спецслужба,2022-10-17,Political,positive
украина новости война,сообщать взрыв одесса ,2022-10-16,Shelling,negative
украина новости война,румыния выделить млн оборона украина молдова программа нато newsmaker министр иностранный румыния богдан ауреска заявить направить орган власть страна включая,2022-10-15,Political,positive
украина новости война,белгород добавить нечего ,2022-10-15,Political,neutral
украина новости война,приблизительный количество остаться высокоточный ракета рф ,2022-10-14,Shelling,negative
украина новости война,беларусь нечего воевать украина решиться шаг украина готовый военный эксперт жданов время беларусь учиться находить диверсант сообщить якобы иностранный спецслужба,2022-10-12,Shelling,positive
украина новости война,сообщать взрыв киев украина масштабный воздушный тревога обновить состояние угроза воздушный атака распространиться западный область украина upd состояние тревога объявить,2022-10-09,Shelling,negative
украина новости война,атака киевский область дронамикамикадзе подтвердить видео момент прилёт ,2022-10-05,Shelling,negative
украина новости война,ядерный удар украина рассматриваться нападение нато сенатор сша линдсить грэм путин продолжить угрожать украина применить ядерный оружие широкомасштабный нападение нато,2022-09-30,Political,negative
украина новости война,выезд временно оккупировать территория запорожье приостановить неопределённый срок сообщить глава луганский ова сергей гайдай гайдай сообщить номер который узнать информация,2022-09-30,Humanitarian,neutral
украина новости война,николаев сообщать сильный взрыв ,2022-09-29,Shelling,neutral
украина новости война,взрывной волна днепр житель выбить окно ,2022-09-29,Shelling,negative
украина новости война,чиновник черниговский ова обвинять массовый хищение гуманитарка расследовать полиция черниговщина разгореться скандал возможный хищение чиновник ова глава вячеслав чаус тонна,2022-09-28,Political,negative
украина новости война,чоловіка знайидти шукать свекруха мешканці ізюма приходять масова похованний щоб знайти тіть родичіть кореспондент поспілкувався з двома жінками які хочуть,2022-09-23,Political,neutral
украина новости война,коллаборант партнёр медведчук столара договариваться власть пытаться скрыться псевдоблаготворительность недавний выход расследование батальон один фигурант столара реальный местонахождение скрываться полномасштабный,2022-09-22,Political,positive
украина новости война,пророссийский называть избирательный комиссия херсонский область утвердить форма текст бюллетень псевдореферендум русский украинский язык бюллетень звучать подчеркнуть выход херсонский область,2022-09-21,Political,positive
украина новости война,называть днр заявить общественный палата выступить инициатива проведение онлайнголосование псевдореферендум ряд территория оккупант не пытаться заморочиться проведение псевдореферендум ,2022-09-20,Political,neutral
украина новости война,общественный палата днр обратиться свой главарь пушилин призыв банановый брат незамедлительно провести референдум присоединение рф аналогичный инициатива выступить самопровозглашённый власть,2022-09-19,Political,positive
украина новости война,королевский стражник упасть обморок дежурство гроб елизавета ii вестминстерский дворец помощь мужчина поспешить полиция трансляция церемония ненадолго прерваться инцидент стражник,2022-09-15,Humanitarian,positive
украина новости война,кривой рог прозвучать взрыв прилёт подниматься дым ,2022-09-14,Shelling,negative
украина новости война,харьковский полтавский днепропетровский область многий житель пропасть некоторый сбоить причина неизвестный выяснять донецкий область кременчуг некоторый место отключить многий область,2022-09-11,Shelling,negative
украина новости война,бердянск сообщать сильный взрыв ,2022-09-08,Shelling,neutral
украина новости война,последствие удар армия рф многоэтажка центр харьков утренний мирный харьков вздрогнуть мощный взрыв российский ракета попасть жилой многоэтажка устанавливать пострадать,2022-09-06,Shelling,negative
украина новости война,рекомендуємый підписатиться найбільший телеграм канал столиці реальний киїть канал є фахівць моніторингової групить попереджають ракетні інші небезпек чи закрить небо,2022-09-04,Shelling,negative
украина новости война,запорожский аэс отключить сеть остановить действовать реактор магатэ реактор продолжать работа производить электроэнергия охлаждение важный функция безопасность площадка домашний хозяйство,2022-09-03,Humanitarian,positive
украина новости война,оон закрывать глаз зверство россиянин армия воевать делать не замечать создать россиянин концлагерь центр европа издеваться убивать человек хвастаться комментировать,2022-09-02,Political,negative
украина новости война,уничтожить рашистский бмп гдеть запорожский донецкий область ,2022-09-02,Shelling,negative
украина новости война,администрация байден ввести ограничение продажа высокотехнологичный компьютерный чип китай россия the new york times сообщать ограничение касаться высокотехнологичный модель чип,2022-09-01,Economical,neutral
украина новости война,армия рф обстрелять украинский город территория август европейский исследователь война сообщать вчера огонь вражеский реактивный ствольный артиллерия оказаться населить пункт,2022-09-01,Shelling,negative
украина новости война,харьков сообщать взрыв город область объявить воздушный тревога ситуация харьков область переходить ссылка подписываться ,2022-08-31,Shelling,negative
украина новости война,всу юг отработать пункт управление вражеский войско транспортный артерия каховский дарьевский два антоновский мост около юг степень повреждение максимально ограничивать,2022-08-31,Shelling,negative
украина новости война,вечерний обращение владимир зеленский щорок останні вихідні літ нашіть державі відзначалисить святой міст донецька і шахтарь році окупантіть уса змінилось,2022-08-28,Political,neutral
украина новости война,село великий костромка днепропетровский область оккупант попасть жилой дом мэр зеленодольск дмитрий невесёлый результат обстрел произойти пожар спасатель потушить не,2022-08-24,Shelling,negative
украина новости война,временно оккупировать херсон сообщать взрыв ,2022-08-22,Shelling,negative
украина новости война,фсб рф опубликовать видео якобы подозревать убийство дарья дугин наталья вовк видео показать въезжать россия дочь заселяться якобы дарья выезжать,2022-08-22,Shelling,negative
украина новости война,сак крым сообщать взрыв ,2022-08-21,Shelling,negative
украина новости война,независимость оккупант провести теракт участие пленный защитник азовсталь гур срочный порядок сцена мариупольский филармония монтироваться железный клетка содержать украинский защитник,2022-08-19,Humanitarian,positive
украина новости война,бой донбасс идти песок трасса основный подход донецк запад британский разведка данные донбасс выть основное поддерживать россия боевик днр предпринимать,2022-08-14,Political,neutral
украина новости война,восток украина сбить вражеский ракета война война счёт воздушный командование восток двести поразить воздушный цель июль подразделение выпустить вражеский крылатый,2022-08-07,Shelling,negative
украина новости война,последствие регулярный обстрел никополь ночью очередной обстрелять град никополь корреспондент побывать место прилёт последний несколько день запечатлеть масштаб разрушение принести,2022-08-05,Shelling,negative
украина новости война,железнодорожный сообщение херсонский область крым не работать удар всу эшелон рф боеприпас британский разведка россиянин отремонтировать железнодорожный ветка течение несколько,2022-08-03,Political,negative
украина новости война,вс азербайджан начать боевой действие нагорный карабах северный северозападный направление данные называть министерство оборона арцах попытка пресечь сми писать прямо,2022-08-01,Shelling,positive
украина новости война,наслать причина косово сербский конфликт прочий новый сведение рашка посёлок городской тип средневековье великий жупа объединение родовой община замкнутый территория,2022-08-01,Political,positive
украина новости война,ес поприветствовать решение косово отстрочить месяц запрет сербский документ верховный представитель ес жозефа боррель ожидать такой решение косовский серб разблокировать,2022-08-01,Political,positive
украина новости война,питер выпустить браковать партия ракета изз низкий качество исполнение деталь не уничтожать ракета himars кужугетович шойгу лично доложить начальник главное,2022-07-27,Shelling,neutral
украина новости война,папа франциск заявить хотеть посетить украина попытаться положить пятимесячный война который неоднократно осуждать большой желание поехать киев папа отвечать возможный,2022-07-24,Political,positive
украина новости война,изюм оккупант пытаться обустроить переправа северский донец обновить сообщать видео оскол изюм речка оскол плотина разбить ,2022-07-18,Shelling,positive
украина новости война,сеть появляться сообщение астрахань выпустить ракета информация требовать уточнение неправдивый расчётный подлёт ракета зависимость город время мэр иванофранковск сообщать ,2022-07-16,Shelling,neutral
украина новости война,млрд гривна предварительный сумма ущерб окружающий среда результат российский вторжение украина сегодняшний рассчитывать убыток оккупант нанести наш окружающий среда общий,2022-07-15,Shelling,negative
украина новости война,немец предлагать перезимовать греция средиземный море зима холодный bild издание цитировать министр туризм греция василиса кикилиас осень зимой грек рада,2022-07-15,Political,positive
украина новости война,важный новость кндр признать днр фото посол кндр рф син хон чхолить вручать посол днр рф ольга макеев документ признание,2022-07-13,Political,positive
украина новости война,видео предварительно извержение вулкан курильский остров ,2022-07-10,Humanitarian,negative
украина новости война,россия вовсю радоваться уход джонсон обвинять обстрел курск брянск спикер госдума рф володин написать клоун уходить мытый знать дело клоун,2022-07-07,Political,positive
