channel_name,text,date,news_type,sentiment_type
украина новости война,ес готовить юридический база передача заморозить российский актив украина восстановление война заявить глава еврокомиссия урсула фон дер ляйена речь идти,2022-07-06,Economical,positive
украина новости война,україич держава де найвищий цінність є людин і ми воюємый протить агресор який найвискать цінність це зброй подписать владимир зеленский,2022-06-30,Humanitarian,neutral
украина новости война,украина самый употреблять the new york times использовать публикация второе занимать который упоминать тысяча согласно подсчёт пользователь reddit напомнить самый,2022-06-29,Humanitarian,positive
украина новости война,николаев подтвердить утренний взрыв утро николаев прогреметь мощный взрыв место выехать спасатель медик сообщить мэр город александр сенкевич следить ситуация,2022-06-29,Shelling,positive
украина новости война,славянск донецкий область россиянин ночью нанести удар мэр вадим лях повредить дом линия электропередача город остаться свет информация пострадать ,2022-06-27,Shelling,negative
украина новости война,оккупант погибнуть украина общий боевой потеря враг украина июнь фото ,2022-06-27,Shelling,negative
украина новости война,мажоруклонист глеб лирник угрожать военный ранее писать киевский мажор эксдепутат киевоблсовет бпп глеб лирник отмазываться мобилизация прикрываться должность почётный консульство,2022-06-25,Political,neutral
украина новости война,страшный биологический оружие украина имя роберто лететь кошмаритя кремль ,2022-06-19,Political,negative
украина новости война,очаков сообщать взрыв николаевский область писать пво сбить один ракета область объявить воздушный тревога ,2022-06-19,Shelling,negative
украина новости война,владимир зеленский пройтись киев борис джонсон відвідать з борис джонсон святомихайлівський золотоверхий монастир прогулялисить михайлівська площий побувать виставці знищеної військової,2022-06-17,Political,neutral
украина новости война,украина существовать карта медведев выдать порция маразм свой tgканал кстати высказаться советник глава офис президент украина михаил подоляк российский империализм,2022-06-15,Political,positive
украина новости война,отмена признание независимость литва угроза франция продолжать нести угроза мир россия депутат госдума предложить отменить признание независимость литва зарегистрировать соответствие,2022-06-08,Political,positive
украина новости война,боец ссо азов ближний бой делать распаковка русский солдат запорожский направление конец самый красивый видео украинский солдат бросать граната окоп,2022-06-06,Shelling,positive
украина новости война,британия хотеть отправить отставка борис джонсон reuters консервативный партия провести голосование недоверие премьерминистр лидер партия борис джонсон среда июнь основание,2022-06-06,Political,positive
украина новости война,болельщик скандировать зсу ,2022-06-01,Political,neutral
украина новости война,больно не бросить человек обстрел лиза чернышенко вывозить человек попасная несмотря ранить два сквозной ранение село руль спасти человек необыкновенный,2022-05-31,Shelling,negative
украина новости война,украина получить достаточно противокорабельный ракета harpoon потопить черноморский флот рф заявить спикер одесский ова сергей братчук передать столько гарпун мочь,2022-05-28,Shelling,negative
украина новости война,школа штат техас сша произойти теракт погибший начальный школа техасский город робба произойти стрельба сообщать abc news жертва стрельба школа,2022-05-24,Humanitarian,negative
украина новости война,не знаєш де знайти робот зараз роботодавці шукають відеодизайнерить викладачі itшкола фахівці з вирішенний конфліктіть споживачіть ці інші вакансії чекають,2022-05-24,Humanitarian,neutral
украина новости война,россиянин обстрелять приграничный зона черниговский область около північа наблюдатель зафиксировать приход территория россия вероятно агс район населить пункт сеньковка потеря,2022-05-22,Shelling,negative
украина новости война,российский оккупант обстрелять тц квадро авдеевка май выгореть полностью верхний этаж который располагаться спортзал российский военный продолжать освобождать спорт образование,2022-05-20,Shelling,neutral
украина новости война,навіть пікассо буть декілька вишиванка але звідка справа що першоя дружина пікассо була українка ольга хохлов з ніжина українка танцювала,2022-05-19,Political,neutral
украина новости война,знаменитый кот степан харьков получить престижный премия wiba канны world influencers and bloggers awards wiba первый мир церемония награждение блогер,2022-05-19,Humanitarian,positive
украина новости война,министр оборона украина резник сообщить новый приказ защитник сохранить жизнь происходить сложный процесс число переговорный помощь красный крест следствие эвакуация,2022-05-17,Humanitarian,positive
украина новости война,воин отдельный горноштурмовой закарпатский бригада уничтожить миномётный секция российский оккупант постараться инженерносаперный подразделение ,2022-05-15,Shelling,negative
украина новости война,депутат российский госдума олег морозов угрожать польша война свой заявление россия раковый опухоль контрибуция который должный выплатить украина польша побуждать,2022-05-14,Political,negative
украина новости война,людяність любов повага життить українські військові попрать війн надзвичайно важкі умовить піклуються тихнуть хто цьий потребує найбільша окоп автівкаха позиціь,2022-05-13,Political,neutral
украина новости война,район угроза артобстрел укрытие ,2022-05-10,Political,negative
украина новости война,херсонщина продолжаться лесной пожар близкий лёт южный регион подверженный пожар лесной камышовый зона продолжаться пожар не тушить день причина российский,2022-05-09,Shelling,negative
украина новости война,российский офицер снимать боевой позиция охрана парад разрушить мариуполь гур мо охранять кремлёвский убийца насильник пропагандист заставить командный состав мотострелковый,2022-05-07,Humanitarian,negative
украина новости война,ес прекратить импорт российский уголь лето конец отказаться российский нефть канцлер германия олафа шольц интервью газета индиана экспресс ранее сми,2022-05-02,Economical,neutral
украина новости война,житель северный восточный район харьков просить не выходить укрытие необходимость связь интенсивный обстрел написать глава харьковский ова олег синегуб частность,2022-05-01,Shelling,neutral
украина новости война,губернатор брянский область александр богомаз заявить сторона украина миномёт обстрелять пограничный пункт посёлок белый берёзка пострадать слово ,2022-04-29,Shelling,negative
украина новости война,посольство сша украина вернуться лев представитель посольство отправиться лев встретиться ключевой партнёр число мид украина визит первый шаг регулярный поездка,2022-04-27,Political,positive
украина новости война,як кількість конфліктіть який росіть зокрем кремль брать участь сучасна історіть ми нарахувалить більша хотать кремлівські пропагандистить скажуть що це,2022-04-25,Political,neutral
украина новости война,видео эпичный пожар брянск слово буквально подобный взрыв российский нефтебаза потребность нефтяной эмбарго сторона ес отпасть россия нечего поставлять благодатный,2022-04-25,Shelling,negative
украина новости война,арміть щоденно виконує безліч завдань захист і визволеннить український територіть від окупант сьогодні найбільші бої існуванний українить тривають східний кордон,2022-04-24,Political,neutral
украина новости война,уничтожить мариуполь провозгласить любой псевдореспублика выйти любой переговоры зеленский президент украина раскритиковать действие оккупант желание организовать референдум временно оккупировать территория,2022-04-23,Political,negative
украина новости война,час утро тц портсити начаться эвакуация житель мариуполь запорожье сообщать советник мэр андрющенко ,2022-04-23,Political,positive
украина новости война,освободить гостомела прямо гореть святопокровский церковь киев,2022-04-22,Shelling,neutral
украина новости война,беженец украина решить поехать швейцария не смочь самостоятельно выбрать проживание swissinfo распределять населить пункт учёт возможность регион ,2022-04-22,Humanitarian,positive
украина новости война,новость дурка мадам сын умереть война украина попрежний уважать путин гордиться армия посмотреть zомбировать ,2022-04-21,Political,neutral
украина новости война,бывший топменеджер газовый компания новатэк семья найти мёртвый испания сообщаться протосеня владеть состояние млн проживать франция испания семья прибыть пасхальный,2022-04-21,Economical,positive
украина новости война,песок назвать заявление данилов готовность нанести удар крымский мост анонсирование теракт ничто иной анонсирование теракт не назвать рот ухо бояться,2022-04-21,Political,negative
украина новости война,запасаться попкорн ждать новый заявление успешный ход спецоперация украина ,2022-04-21,Shelling,positive
украина новости война,организатор итальянский регата запретить участие российский яхта ,2022-04-21,Political,neutral
украина новости война,украина согласный предложить оон пасхальный перемирие заявить мид украина ,2022-04-20,Political,positive
украина новости война,рф звучать угроза сторона финляндия швеция фон нападение россия украина подумывать вступление нато альянс случай подача заявка страна готовый принять,2022-04-20,Political,positive
украина новости война,киев вернуться диппредставительство мид украина ,2022-04-19,Political,neutral
украина новости война,энергоатом отказываться российский уран аэс прессслужба ,2022-04-18,Shelling,negative
украина новости война,роман абрамович приехать киев попытаться вдохнуть мирный переговоры россия украина fortune абрамович киев попытаться возобновить мирный переговоры россия украина заслать,2022-04-16,Political,positive
украина новости война,лычаковский районный суд львов изменить мера пресечение нардеп виктор медведчук отправить арест возможность внесение залог прислать новость,2022-04-16,Political,neutral
украина новости война,вокзал мариуполь приход русский прислать новость,2022-04-16,Humanitarian,positive
украина новости война,медведчук вывести минный поле тысяча военнопленный марченко вчерашний прессконференция решить посоревноваться фейкньюс российский пропагандист прислать новость,2022-04-16,Political,negative
украина новости война,воин бригада холодный ярый превратить уничтожение руснуть настоящий искусство какой линия перспектива какой изгиб прислать новость,2022-04-15,Political,positive
украина новости война,джо байден попасть неловкий ситуация выступление развернуться протянуть рука воздух джо держаться прислать новость,2022-04-15,Political,positive
украина новости война,наш защитник украина минус зарядить ракета вражеский град техника прислать новость,2022-04-15,Shelling,negative
украина новости война,рашка истерика изз сгореть утонуть москва нравиться звучать какойтый дед срываться голос не плакать уточнить вести иметь вид война ,2022-04-15,Political,negative
украина новости война,мирный житель ребёнок вывезти оккупант мариуполь минувший сутки апрель уполномоченный врать право человек людмила денисов данный момент находиться пункт оказание,2022-04-14,Shelling,neutral
украина новости война,нидерланды задержать российский яхта сnn правительство нидерланды заявить настоящий яхта судно россия не покинуть нидерланды изз таможенник поместить усиленный контроль,2022-04-13,Economical,positive
украина новости война,арестович медведчук сбу задержать не киев медведчук не киев взять служба безопасность украина скажем деликатно искать искать найти заявить арестович,2022-04-12,Political,positive
украина новости война,следовать ожидать время тревога объявить иванофранковский область прислать новость,2022-04-12,Political,negative
украина новости война,юрий дудь посвятить выпуск беженец украина бескорыстный человек помогать не смотреть делиться ссылка прислать новость,2022-04-12,Humanitarian,positive
украина новости война,варшава национализировать комплекс здание принадлежать россия ремонт построить квартира беженец украина сообщить мэр варшава рафал тшасковский прислать новость,2022-04-12,Political,positive
украина новости война,сми появиться информация возможный использование зарина мариуполь клинический картина воздействие зарина человек первый признак воздействие зарина бова нервнопаралитический действие человек,2022-04-11,Political,positive
украина новости война,загиблихо кількість жертва результаті ракетный удар краматорська зрослый повідомляє начальник донецької ова павло кириленко,2022-04-10,Shelling,negative
украина новости война,полицейский орган сша отправлять защитный снаряжение мирный житель украина эксперт назвать беспрецедентный шаг cnn намерение пожертвовать украинец защитный снаряжение число,2022-04-10,Political,positive
украина новости война,оккупант погибнуть украина боевой потеря враг апрель выше прислать новость,2022-04-10,Shelling,negative
украина новости война,киноакадемия сша запретить уилла смит посещать мероприятие церемония оскар изз инцидент пощёчина ведущий прислать новость,2022-04-09,Political,negative
украина новости война,видео прожить оккупация месяц прийтись свой тело прикрывать дочь показывать орк свидетельство рождение подтверждать дочь волновать живой сосед не остаться,2022-04-08,Shelling,positive
украина новости война,завершенний навчальный рок міністерство з питаня реінтеграції тимчасовый окупований територіть українить спільный з міністерство освіть і наука підготувать роза яснювальна,2022-04-07,Humanitarian,positive
украина новости война,захватить российский оккупант запорожский аэс находиться захватчик единица тяжёлый техника министр энергетика герман галущенко,2022-04-06,Shelling,negative
украина новости война,бывший мэр город рубежный сергей хорт не перейти сторона российский захватчик передавать оккупант информация человек проукраинский позиция сообщить глава луганский,2022-04-06,Political,negative
украина новости война,украинский военный сутки отбить вражеский атака донбасс штаб оос,2022-04-06,Shelling,negative
украина новости война,зеленский показать видео последствие зверство оккупант совбез оон не оставить равнодушный никто,2022-04-05,Political,negative
украина новости война,зеленский пообщаться журналист,2022-04-05,Political,neutral
украина новости война,тревога весь уходить укрытие беречь,2022-04-05,Shelling,negative
украина новости война,белгород слышный взрыв глава администрация яковлевский городской округ белгородский область заявить слышный хлопок земля упасть обломок российский ракета не качественный,2022-04-03,Shelling,negative
украина новости война,советник глава оп член украинский делегация переговоры михаил подоляк считать гарантия безопасность прорабатываться переговоры рф случай новый война украина должный,2022-04-03,Political,positive
украина новости война,мэр буча анатолий федора сообщить город момент освобождение украинский армия найти похоронёный братский могила,2022-04-02,Shelling,neutral
украина новости война,венгрия не хотеть применять санкция россия изз холод ввести санкция импорт энергоресурсы остановить работа газопровод венгрия стать не холодный температура,2022-04-02,Economical,negative
