channel_name,text,date,news_type,sentiment_type
украина новости война,первый фото освободить российский оккупант шестовица черниговский область оперативный командование север,2022-04-01,Shelling,negative
украина новости война,утром центр освободить ворзель уваровский дом местный житель водрузить флаг ,2022-04-01,Shelling,neutral
украина новости война,читать защитник,2022-03-30,Political,positive
украина новости война,ответ голова русский мать посылать ребёнок умирать ,2022-03-29,Political,positive
украина новости война,киевский область грузинский доброволец общаться мирный население освободиться село житель благодарить воин освобождение село,2022-03-28,Shelling,positive
украина новости война,чехия заморозить имущество российский олигарх сотня крона премьерминистр чехия пётр фиал заявить страна заморозить имущество попасть санкция ес российский олигарх,2022-03-28,Economical,neutral
украина новости война,воздушный тревога кривая рог никополь,2022-03-27,Shelling,negative
украина новости война,финляндия столкнуться угроза нарушение граница сторона рф решить подать заявка членство нато президент страна сауля ниинистё страна возрасти поддержка вступление,2022-03-27,Political,positive
украина новости война,байден назвать путин мясник встреча украинский беженец польша байден ответить журналист думать путин байден мясник,2022-03-26,Political,neutral
украина новости война,вчера харьков снаряд прилететь газопровод the new york times опубликовать фото видео последствие комментарий очевидец,2022-03-26,Shelling,negative
украина новости война,убитый генерал резанец родиться село елбанка устьпристанский район алтайский край многое прояснять,2022-03-25,Shelling,neutral
украина новости война,пентагон видеть признак наступление украина отдельный участок американец не знать являться манёвр всу часть больший оперативный план украинец не защищаться,2022-03-23,Political,neutral
украина новости война,новый спутниковый снимок аэродром херсон легендарный чернобаевка показать российский военный вертолёт многочисленный потеря армия рф решить увести авиация матч россия,2022-03-23,Shelling,neutral
украина новости война,politico назвать президент зеленский самый влиятельный человек европа выбор читатель издание важно сообщение регулярный видео соцсеть видеоречь парламент многий страна,2022-03-22,Political,positive
украина новости война,министр иностранный греция хотеть отправиться гуманитарный миссия мариуполь,2022-03-22,Political,positive
украина новости война,херсон солдат рф избивать мирный житель,2022-03-21,Humanitarian,neutral
украина новости война,глава мид германия аннален бербок ожидать украинский беженец прогноз сделать поле встреча глава мид евросоюз брюссель слово евросоюз следовать готовиться,2022-03-21,Political,neutral
украина новости война,мінус ще ворожий вертоліт сьогодні бучанський районі підрозділ ппо св українить збитый ворожий бойовие вертоліт дякуємый хлопць захистый нашой небо,2022-03-19,Economical,neutral
украина новости война,дом бой мариуполь,2022-03-19,Shelling,negative
украина новости война,один крупный мир нефтесервисный корпорация schlumberger принять решение прекратить инвестиция внедрение технология деятельность территория россия сми,2022-03-19,Political,positive
украина новости война,север киевский область военный забирать техника оккупант брать плен пытаться отступить сторона граница,2022-03-19,Shelling,negative
украина новости война,алексей арестович telegram советник руководитель офис президент срочный порядок транслировать ход война,2022-03-18,Political,positive
украина новости война,всу освободить село посадпокровский херсонский область разбить колонна оккупант ждать официальный подтверждение,2022-03-17,Shelling,negative
украина новости война,наш боец харьков водитель вражеский грузовик отправиться концерт кобзон,2022-03-16,Shelling,negative
украина новости война,marvel не сниться герой наш,2022-03-16,Political,neutral
украина новости война,совет европа путин чётко давать мир,2022-03-16,Political,positive
украина новости война,информация мужчина разрешить выезжать загранец какой условие крупный помощь государство право не платить кредит коммуналка любой платёж,2022-03-15,Political,positive
украина новости война,харьков жилой массив новый дом подарок русский,2022-03-15,Shelling,positive
украина новости война,азов уничтожить генералмайор рашистовый фамилия должность неизвестный,2022-03-15,Shelling,negative
украина новости война,під черніговый зсу знищить батарея рсзвый окупантіть з якої вонь обстрілювать житлові кварталь міст,2022-03-15,Political,negative
украина новости война,оперативный інформаціть стан щодый російський вторгненний стан положенний характер дій сила оборонить суттєвих змін доба угрупованнь повітряний сила збройних сила,2022-03-15,Economical,positive
украина новости война,посмотреть какой дыра лезть орда,2022-03-14,Political,negative
украина новости война,янукович рассказать новость предлагать зеленский план урегулирование донбасс получить отказ переводить послать нахть,2022-03-14,Political,neutral
украина новости война,чугуев харьковский область обстрел детский сад погибнуть парень март российский войско совершить артиллерийский обстрел детский сад чугуев осколок убить парень,2022-03-14,Shelling,negative
украина новости война,кремль данные посещение кадыров украина песок,2022-03-14,Political,neutral
украина новости война,речницть дснс звернуться антон геращенок ви вже третіть здаєт російський окупанты точка які вонь обстрілюють ви втретє називаєт точать адрес,2022-03-14,Humanitarian,negative
украина новости война,глава мид дмитрий кулеб предупредить гражданин сирия сербия вероятно приехать воевать сторона рф предупреждать иностранный гражданин настроить присоединиться российский сила,2022-03-13,Political,positive
украина новости война,військовия оркестр піднімає дух пісня гігантський прапор відбуваться біль львівський вокзал,2022-03-13,Political,neutral
украина новости война,британия платить свой гражданин фунт стерлинг доллар месяц смочь предложить беженец украина свободный комната квартира минимум месяц,2022-03-13,Economical,positive
украина новости война,автор роман минин,2022-03-12,Political,neutral
украина новости война,святослав вакарчук лідёр гурт океан ельзить записать зверненний маріупольціть український музикант подякувать містян захисник маріуполь витримка стійкість дух маріуполь демонструє,2022-03-11,Political,neutral
украина новости война,інформаціть щодый обстріліть миколаєві від ода віталіть кім новобузька пожёж кафе мир пожёж авто космонавтіть приліт снаряд васляєв снаряд квартира,2022-03-11,Shelling,negative
украина новости война,потерять работа россия столько работать mcdonalds ikea иностранный компания остановить пересмотреть работа россия картинка statista собрать дать десять компаниямлидер суммарно,2022-03-11,Economical,positive
украина новости война,евросоюз достигнуть предел возможность касаться финансовый санкция россия глава дипломатия ес жозеп боррель,2022-03-10,Economical,positive
украина новости война,какой время шутка,2022-03-09,Political,neutral
украина новости война,удар роддом мариуполь не случайный час представительница мид рф захаров брифинг назвать женщина нацбат место рождение ребёнок огневой позиция,2022-03-09,Political,positive
украина новости война,президент штат байден призвать конгресс сша принять пакет помощь украина сумма млрд доллар,2022-03-09,Political,positive
украина новости война,николаев владелец демилитаризовать брдм бронировать разведывательнодозорный машина передать автомобиль нужда николаевский областной караул автомобиль выполнять транспортный услуга заказ автомобиль выполнять,2022-03-08,Shelling,neutral
украина новости война,разбали гавный,2022-03-07,Political,neutral
украина новости война,украинец,2022-03-07,Humanitarian,neutral
украина новости война,появиться видео обстрел николаев вероятно установка смерч поступать информация прилетать город пригород,2022-03-07,Shelling,negative
украина новости война,обращение алексей арестович касательно ситуация киевский область,2022-03-06,Political,neutral
украина новости война,похоже руснуть заканчиваться нормальный военный техника,2022-03-06,Shelling,negative
украина новости война,буча грань город свет тепло связь продукт беда житель кричать помощь,2022-03-06,Humanitarian,positive
украина новости война,porsche пожертвовать млн евро поддержка украинец пострадать российский вторжение евро направиться увкб оон агентство оон дело беженец действовать украина остальной,2022-03-05,Economical,neutral
украина новости война,посольство украина нигерия сообщить доброволец желать воевать сторона украина нігерійці й ті хочуть пидить москаліть,2022-03-05,Political,neutral
украина новости война,успешный атака украинский птур танк оккупант боекомплект взорваться оторвать башня,2022-03-04,Shelling,negative
украина новости война,позиция рф жёсткий позиция украина жёсткий поэтому переговоры тяжело продолжаться советник офис президент подоляк,2022-03-04,Political,neutral
украина новости война,варламов похоже ночной смена роскомнадзор чтоть нажать исчезнуть посмотреть выглядеть интернет утро утром интернет россия,2022-03-04,Humanitarian,positive
украина новости война,херсон область ворог окупувать телевежа телерадіомовленний й розповсюджуватима новини інформаціть херсон звичайный це величезный кількість фейкіть дезінформації пропаганди уряд ніколя,2022-03-03,Shelling,negative
украина новости война,российский авиация разбомбить школа чернигов известно девять погибнуть,2022-03-03,Shelling,negative
украина новости война,путин провести совещание постоянный член совбез песок,2022-03-03,Political,neutral
украина новости война,попасная луганский область российский обстрел умереть двое мирный житель разрушить,2022-03-03,Shelling,negative
украина новости война,стілька разіть хотіть знищить не змочь ми пройидти стілька всьий і якщый хтося думає що подолать це українці злякаються зламаються,2022-03-03,Political,neutral
украина новости война,hm прекратить продажа россия тенденция продолжаться,2022-03-02,Economical,neutral
украина новости война,полк азов наводить артиллерия беспилотник удар попасть российский бронеавтомобиль рысь камаз,2022-03-01,Shelling,negative
украина новости война,чугуев аэродром,2022-03-01,Shelling,negative
украина новости война,післить удар площі свободить харкові росіть це державатерорист зверненний президент українить володимир зеленський,2022-03-01,Shelling,negative
украина новости война,украинский посол генеральный ассамблея оон путин хотеть совершить самоубийство не использовать ядерный арсенал последовать пример чувак берлинский бункер май,2022-02-28,Political,negative
украина новости война,,2022-02-28,Political,neutral
украина новости война,сми сообщать планировать глушить связь черниговский сумский харьковский запорожский одесский область киевщиня донбасс параллельно готовиться хакерский атака украинский медиа массовый,2022-02-28,Shelling,negative
украина новости война,всу гвардейский днепропетровский область ликвидировать колонна диверсант,2022-02-27,Shelling,negative
украина новости война,вышгород взрыв,2022-02-26,Shelling,negative
украина новости война,терміново кіберполіціть створить спеціальний бот повідомлень виявлені міткать які окупанти лишають дорога можный сфотографуватить точка і вонь потраплять єдиної бази,2022-02-26,Shelling,negative
украина новости война,зверненний зеленський головня ердоган разом з азербайджанський лідёр ільхам алієвить запропонувать взять організаціть переговоріть з росієть азербайджан змож допомоготь україні,2022-02-26,Political,neutral
украина новости война,мозырь гомельский область беларусь сообщать город заметить российский авиация изпод калинковичи вестись запуск ракета,2022-02-26,Shelling,neutral
украина новости война,закрашивание метка наведение не помогать прежний видно ультрафиолет чемтый закрывать заливать грязь сбивать тд,2022-02-25,Political,negative
украина новости война,сума район артучилище самый больший бой вчера направление контролировать военный,2022-02-25,Shelling,negative
украина новости война,ворзель київська область можливия захід противник навколишні населені пункть быть напоготові,2022-02-25,Shelling,negative
украина новости война,метро харьков,2022-02-24,Shelling,negative
украина новости война,ситуация минута,2022-02-24,Shelling,neutral
украина новости война,российский сми сообщать днр объявить чс государственный уровень связать остановка насосный станция первый подъём южнодонбасский водовод прекращение централизовать питьевой водоснабжение,2022-02-21,Political,positive
украина новости война,зона оос начать прибывать нардеп министр время журналист андрей цаплиенко сообщать боевик обстреливать кпвва счастие миномёт попасть грузовик важный секунда,2022-02-19,Shelling,neutral
украина новости война,берлин закончиться встреча советник лидер страна нормандский четвёрка украина россия франция германия итог встреча проходить час глава офис президент ,2022-02-11,Political,positive
,,